question,url,matched_keywords,drafted_answer,timestamp
What is the best Spotify mass view bot for mass followers?,https://www.quora.com/What-is-the-best-Spotify-mass-view-bot-for-mass-followers,Growth Hacking,Short draft (do not post): perspective on Growth Hacking. Context: “What is the best Spotify mass view bot for mass followers?”.,2025-10-03T18:54:06.845Z
How do I get more followers on Instagram?,https://www.quora.com/How-do-I-get-more-followers-on-Instagram-8,Growth Hacking,Short draft (do not post): perspective on Growth Hacking. Context: “How do I get more followers on Instagram?”.,2025-10-03T18:54:06.845Z
How long does it take to grow a YouTube channel from scratch into millions of subscribers?,https://www.quora.com/How-long-does-it-take-to-grow-a-YouTube-channel-from-scratch-into-millions-of-subscribers,Growth Hacking,Short draft (do not post): perspective on Growth Hacking. Context: “How long does it take to grow a YouTube channel from scratch into millions of subscribers?”.,2025-10-03T18:54:06.845Z
What are some growth strategies for e-commerce?,https://www.quora.com/What-are-some-growth-strategies-for-e-commerce,Growth Hacking,Short draft (do not post): perspective on Growth Hacking. Context: “What are some growth strategies for e-commerce?”.,2025-10-03T18:54:06.845Z
What is the quickest way to increase Instagram followers?,https://www.quora.com/What-is-the-quickest-way-to-increase-Instagram-followers,Growth Hacking,Short draft (do not post): perspective on Growth Hacking. Context: “What is the quickest way to increase Instagram followers?”.,2025-10-03T18:54:06.845Z
How do I grow my business?,https://www.quora.com/How-do-I-grow-my-business,Growth Hacking,Short draft (do not post): perspective on Growth Hacking. Context: “How do I grow my business?”.,2025-10-03T18:54:06.845Z
How can digital marketing help me grow my business?,https://www.quora.com/How-can-digital-marketing-help-me-grow-my-business,Growth Hacking,Short draft (do not post): perspective on Growth Hacking. Context: “How can digital marketing help me grow my business?”.,2025-10-03T18:54:06.845Z
What is the best way to learn business tactics?,https://www.quora.com/What-is-the-best-way-to-learn-business-tactics?no_redirect=1,Growth Hacking,Short draft (do not post): perspective on Growth Hacking. Context: “What is the best way to learn business tactics?”.,2025-10-03T18:54:06.845Z
How Email Marketing Works for your Business?,https://kaitlynburringtonsspace.quora.com/How-Email-Marketing-Works-for-your-Business,Growth Hacking,Short draft (do not post): perspective on Growth Hacking. Context: “How Email Marketing Works for your Business?”.,2025-10-03T18:54:06.845Z
How can I increase followers organically on Instagram?,https://www.quora.com/How-can-I-increase-followers-organically-on-Instagram,Growth Hacking,Short draft (do not post): perspective on Growth Hacking. Context: “How can I increase followers organically on Instagram?”.,2025-10-03T18:54:06.845Z
